{
  "schema_version": "0.1.0",
  "relation_id": "rel_01J5F8QK2ZCONN123124",
  "type": "compare-set-with",
  "from": {
    "kind": "file",
    "location": {
      "source_id": "src_local_eng_share",
      "locator": "engineering/connectors/connector_123.pdf",
      "native_version": { "scheme": "mtime_size", "value": "1723420800:540" }
    },
    "version": {
      "content_digest": {
        "algo": "sha256",
        "hex": "1307657aee613b9ac0a29cfd2ab8865a5012cfc175cbe4b4a2e5166618596e70"
      },
      "size_bytes": 540
    }
  },
  "to": {
    "kind": "file",
    "location": {
      "source_id": "src_local_eng_share",
      "locator": "engineering/connectors/connector_124.pdf",
      "native_version": { "scheme": "mtime_size", "value": "1723420800:540" }
    },
    "version": { "size_bytes": 540 }
  },
  "asserted_by": {
    "precedence": "gyst_suggestion",
    "actor": { "kind": "suggestion", "id": "identity.suffix-analysis/1" }
  },
  "asserted_at": "2024-08-12T09:16:04+00:00",
  "evidence": ["obs_01J5F8QK2ZCONN123001", "obs_01J5F8QK2ZCONN124001"],
  "confidence": 0.35,
  "identity_policy_version": "ip_2024-08-01_r1",
  "explanation": "Numeric suffixes 123 and 124 differ by one, but nothing distinguishes a part-number series from a revision series here. Offered side by side; no supersedes relation asserted."
}
